### ISSUE TITLE
UDP Dump from Script

### ISSUE THREAD

**Issue by philibertschlutzki** [philibertschlutzki/pi_trailcam#67]
`08:45:52.270099 IP 192.168.43.21.46003 > 192.168.43.1.32100: UDP, length 53
        0x0000:  1c4e a292 e0ff 2ccf 6718 c9b2 0800 4500  .N....,.g.....E.
        0x0010:  0051 5dd3 4000 4011 0562 c0a8 2b15 c0a8  .Q].@.@..b..+...
        0x0020:  2b01 b3b3 7d64 003d d5e7 f1d0 0031 d100  +...}d.=.....1..
        0x0030:  0009 4152 5445 4d49 5300 0200 0000 0400  ..ARTEMIS.......
        0x0040:  0100 1900 0000 4f44 5577 4f44 6378 4d6a  ......ODUwODcxMj
        0x0050:  633d 0000 0000 0000 0000 0000 0000 00    c=.............
08:45:52.370335 IP 192.168.43.21.46003 > 192.168.43.1.32100: UDP, length 53
        0x0000:  1c4e a292 e0ff 2ccf 6718 c9b2 0800 4500  .N....,.g.....E.
        0x0010:  0051 5dde 4000 4011 0557 c0a8 2b15 c0a8  .Q].@.@..W..+...
        0x0020:  2b01 b3b3 7d64 003d d5e7 f1d0 0031 d100  +...}d.=.....1..
        0x0030:  0009 4152 5445 4d49 5300 0200 0000 0400  ..ARTEMIS.......
        0x0040:  0100 1900 0000 4f44 5577 4f44 6378 4d6a  ......ODUwODcxMj
        0x0050:  633d 0000 0000 0000 0000 0000 0000 00    c=.............
08:45:52.470575 IP 192.168.43.21.46003 > 192.168.43.1.32100: UDP, length 53
        0x0000:  1c4e a292 e0ff 2ccf 6718 c9b2 0800 4500  .N....,.g.....E.
        0x0010:  0051 5def 4000 4011 0546 c0a8 2b15 c0a8  .Q].@.@..F..+...
        0x0020:  2b01 b3b3 7d64 003d d5e7 f1d0 0031 d100  +...}d.=.....1..
        0x0030:  0009 4152 5445 4d49 5300 0200 0000 0400  ..ARTEMIS.......
        0x0040:  0100 1900 0000 4f44 5577 4f44 6378 4d6a  ......ODUwODcxMj
        0x0050:  633d 0000 0000 0000 0000 0000 0000 00    c=.............
08:45:52.472149 IP 192.168.43.21.46003 > 192.168.43.1.32108: UDP, length 53
        0x0000:  1c4e a292 e0ff 2ccf 6718 c9b2 0800 4500  .N....,.g.....E.
        0x0010:  0051 5df0 4000 4011 0545 c0a8 2b15 c0a8  .Q].@.@..E..+...
        0x0020:  2b01 b3b3 7d6c 003d d5de f1d0 0031 d100  +...}l.=.....1..
        0x0030:  000a 4152 5445 4d49 5300 0200 0000 0400  ..ARTEMIS.......
        0x0040:  0100 1900 0000 4f44 5577 4f44 6378 4d6a  ......ODUwODcxMj
        0x0050:  633d 0000 0000 0000 0000 0000 0000 00    c=.............
08:45:52.572379 IP 192.168.43.21.46003 > 192.168.43.1.32108: UDP, length 53
        0x0000:  1c4e a292 e0ff 2ccf 6718 c9b2 0800 4500  .N....,.g.....E.
        0x0010:  0051 5dfc 4000 4011 0539 c0a8 2b15 c0a8  .Q].@.@..9..+...
        0x0020:  2b01 b3b3 7d6c 003d d5de f1d0 0031 d100  +...}l.=.....1..
        0x0030:  000a 4152 5445 4d49 5300 0200 0000 0400  ..ARTEMIS.......
        0x0040:  0100 1900 0000 4f44 5577 4f44 6378 4d6a  ......ODUwODcxMj
        0x0050:  633d 0000 0000 0000 0000 0000 0000 00    c=.............
08:45:52.672619 IP 192.168.43.21.46003 > 192.168.43.1.32108: UDP, length 53
        0x0000:  1c4e a292 e0ff 2ccf 6718 c9b2 0800 4500  .N....,.g.....E.
        0x0010:  0051 5e0a 4000 4011 052b c0a8 2b15 c0a8  .Q^.@.@..+..+...
        0x0020:  2b01 b3b3 7d6c 003d d5de f1d0 0031 d100  +...}l.=.....1..
        0x0030:  000a 4152 5445 4d49 5300 0200 0000 0400  ..ARTEMIS.......
        0x0040:  0100 1900 0000 4f44 5577 4f44 6378 4d6a  ......ODUwODcxMj
        0x0050:  633d 0000 0000 0000 0000 0000 0000 00    c=.............
pi@raspberrypi:/tmp $ `

Im File https://github.com/philibertschlutzki/pi_trailcam/blob/main/tests/MITM_Captures/export%20packets.txt sind die UDP Dumps wie folgt definiert.

Frame 2744: Packet, 129 bytes on wire (1032 bits), 129 bytes captured (1032 bits)
Linux cooked capture v2
Internet Protocol Version 4, Src: 192.168.43.1, Dst: 192.168.43.115
Internet Control Message Protocol

No.     Time           Source                Destination           Protocol Length Info
   2745 238.543142     192.168.43.115        192.168.43.1          UDP      101    43555 → 40611 Len=53

Frame 2745: Packet, 101 bytes on wire (808 bits), 101 bytes captured (808 bits)
Linux cooked capture v2
Internet Protocol Version 4, Src: 192.168.43.115, Dst: 192.168.43.1
User Datagram Protocol, Src Port: 43555, Dst Port: 40611
Data (53 bytes)

0000  f1 d0 00 31 d1 00 00 05 41 52 54 45 4d 49 53 00   ...1....ARTEMIS.
0010  02 00 00 00 04 00 01 00 19 00 00 00 4d 7a 6c 42   ............MzlB
0020  33 36 58 2f 49 56 6f 38 5a 7a 49 35 72 47 39 6a   36X/IVo8ZzI5rG9j
0030  31 77 3d 3d 00                                    1w==.

No.     Time           Source                Destination           Protocol Length Info
   2746 238.543299     192.168.43.1          192.168.43.115        ICMP     129    Destination unreachable (Port unreachable)

Frame 2746: Packet, 129 bytes on wire (1032 bits), 129 bytes captured (1032 bits)
Linux cooked capture v2
Internet Protocol Version 4, Src: 192.168.43.1, Dst: 192.168.43.115
Internet Control Message Protocol

No.     Time           Source                Destination           Protocol Length Info
   2747 238.576601     192.168.43.115        192.168.43.1          UDP      101    43555 → 40611 Len=53

Frame 2747: Packet, 101 bytes on wire (808 bits), 101 bytes captured (808 bits)
Linux cooked capture v2
Internet Protocol Version 4, Src: 192.168.43.115, Dst: 192.168.43.1
User Datagram Protocol, Src Port: 43555, Dst Port: 40611
Data (53 bytes)

0000  f1 d0 00 31 d1 00 00 05 41 52 54 45 4d 49 53 00   ...1....ARTEMIS.
0010  02 00 00 00 04 00 01 00 19 00 00 00 4d 7a 6c 42   ............MzlB
0020  33 36 58 2f 49 56 6f 38 5a 7a 49 35 72 47 39 6a   36X/IVo8ZzI5rG9j
0030  31 77 3d 3d 00                                    1w==.

No.     Time           Source                Destination           Protocol Length Info
   2748 238.576760     192.168.43.1          192.168.43.115        ICMP     129    Destination unreachable (Port unreachable)

Frame 2748: Packet, 129 bytes on wire (1032 bits), 129 bytes captured (1032 bits)
Linux cooked capture v2
Internet Protocol Version 4, Src: 192.168.43.1, Dst: 192.168.43.115
Internet Control Message Protocol

No.     Time           Source                Destination           Protocol Length Info
   2749 239.011924     192.168.43.115        192.168.43.1          UDP      101    43555 → 40611 Len=53

Frame 2749: Packet, 101 bytes on wire (808 bits), 101 bytes captured (808 bits)
Linux cooked capture v2
Internet Protocol Version 4, Src: 192.168.43.115, Dst: 192.168.43.1
User Datagram Protocol, Src Port: 43555, Dst Port: 40611
Data (53 bytes)

0000  f1 d0 00 31 d1 00 00 05 41 52 54 45 4d 49 53 00   ...1....ARTEMIS.
0010  02 00 00 00 04 00 01 00 19 00 00 00 4d 7a 6c 42   ............MzlB
0020  33 36 58 2f 49 56 6f 38 5a 7a 49 35 72 47 39 6a   36X/IVo8ZzI5rG9j
0030  31 77 3d 3d 00                                    1w==.
