### ISSUE TITLE
UDP Issue

### ISSUE THREAD

**Issue by philibertschlutzki** [philibertschlutzki/pi_trailcam#69]
Output from https://github.com/philibertschlutzki/pi_trailcam/blob/main/main.py
9:32:23.405999 IP 192.168.43.21.44932 > 192.168.43.1.40611: UDP, length 53
        0x0000:  1c4e a292 e0ff 2ccf 6718 c9b2 0800 4500  .N....,.g.....E.
        0x0010:  0051 65b4 4000 4011 fd80 c0a8 2b15 c0a8  .Qe.@.@.....+...
        0x0020:  2b01 af84 9ea3 003d b8d8 f1d0 0031 d100  +......=.....1..
        0x0030:  0008 4152 5445 4d49 5300 0200 0000 0400  ..ARTEMIS.......
        0x0040:  0100 1900 0000 4f44 5577 4f44 6378 4d6a  ......ODUwODcxMj
        0x0050:  633d 0000 0000 0000 0000 0000 0000 00    c=.............
09:32:23.506228 IP 192.168.43.21.44932 > 192.168.43.1.40611: UDP, length 53
        0x0000:  1c4e a292 e0ff 2ccf 6718 c9b2 0800 4500  .N....,.g.....E.
        0x0010:  0051 65cb 4000 4011 fd69 c0a8 2b15 c0a8  .Qe.@.@..i..+...
        0x0020:  2b01 af84 9ea3 003d b8d8 f1d0 0031 d100  +......=.....1..
        0x0030:  0008 4152 5445 4d49 5300 0200 0000 0400  ..ARTEMIS.......
        0x0040:  0100 1900 0000 4f44 5577 4f44 6378 4d6a  ......ODUwODcxMj
        0x0050:  633d 0000 0000 0000 0000 0000 0000 00    c=.............
09:32:23.606434 IP 192.168.43.21.44932 > 192.168.43.1.40611: UDP, length 53
        0x0000:  1c4e a292 e0ff 2ccf 6718 c9b2 0800 4500  .N....,.g.....E.
        0x0010:  0051 65dd 4000 4011 fd57 c0a8 2b15 c0a8  .Qe.@.@..W..+...
        0x0020:  2b01 af84 9ea3 003d b8d8 f1d0 0031 d100  +......=.....1..
        0x0030:  0008 4152 5445 4d49 5300 0200 0000 0400  ..ARTEMIS.......
        0x0040:  0100 1900 0000 4f44 5577 4f44 6378 4d6a  ......ODUwODcxMj
        0x0050:  633d 0000 0000 0000 0000 0000 0000 00    c=.............
09:32:23.609128 IP 192.168.43.21.44932 > 192.168.43.1.32100: UDP, length 53
        0x0000:  1c4e a292 e0ff 2ccf 6718 c9b2 0800 4500  .N....,.g.....E.
        0x0010:  0051 65de 4000 4011 fd56 c0a8 2b15 c0a8  .Qe.@.@..V..+...
        0x0020:  2b01 af84 7d64 003d da16 f1d0 0031 d100  +...}d.=.....1..
        0x0030:  0009 4152 5445 4d49 5300 0200 0000 0400  ..ARTEMIS.......
        0x0040:  0100 1900 0000 4f44 5577 4f44 6378 4d6a  ......ODUwODcxMj
        0x0050:  633d 0000 0000 0000 0000 0000 0000 00    c=.............
09:32:23.709376 IP 192.168.43.21.44932 > 192.168.43.1.32100: UDP, length 53
        0x0000:  1c4e a292 e0ff 2ccf 6718 c9b2 0800 4500  .N....,.g.....E.
        0x0010:  0051 65e7 4000 4011 fd4d c0a8 2b15 c0a8  .Qe.@.@..M..+...
        0x0020:  2b01 af84 7d64 003d da16 f1d0 0031 d100  +...}d.=.....1..
        0x0030:  0009 4152 5445 4d49 5300 0200 0000 0400  ..ARTEMIS.......
        0x0040:  0100 1900 0000 4f44 5577 4f44 6378 4d6a  ......ODUwODcxMj
        0x0050:  633d 0000 0000 0000 0000 0000 0000 00    c=.............
09:32:23.809590 IP 192.168.43.21.44932 > 192.168.43.1.32100: UDP, length 53
        0x0000:  1c4e a292 e0ff 2ccf 6718 c9b2 0800 4500  .N....,.g.....E.
        0x0010:  0051 65f9 4000 4011 fd3b c0a8 2b15 c0a8  .Qe.@.@..;..+...
        0x0020:  2b01 af84 7d64 003d da16 f1d0 0031 d100  +...}d.=.....1..
        0x0030:  0009 4152 5445 4d49 5300 0200 0000 0400  ..ARTEMIS.......
        0x0040:  0100 1900 0000 4f44 5577 4f44 6378 4d6a  ......ODUwODcxMj
        0x0050:  633d 0000 0000 0000 0000 0000 0000 00    c=.............
09:32:23.812248 IP 192.168.43.21.44932 > 192.168.43.1.32108: UDP, length 53
        0x0000:  1c4e a292 e0ff 2ccf 6718 c9b2 0800 4500  .N....,.g.....E.
        0x0010:  0051 65fa 4000 4011 fd3a c0a8 2b15 c0a8  .Qe.@.@..:..+...
        0x0020:  2b01 af84 7d6c 003d da0d f1d0 0031 d100  +...}l.=.....1..
        0x0030:  000a 4152 5445 4d49 5300 0200 0000 0400  ..ARTEMIS.......
        0x0040:  0100 1900 0000 4f44 5577 4f44 6378 4d6a  ......ODUwODcxMj
        0x0050:  633d 0000 0000 0000 0000 0000 0000 00    c=.............
09:32:23.912480 IP 192.168.43.21.44932 > 192.168.43.1.32108: UDP, length 53
        0x0000:  1c4e a292 e0ff 2ccf 6718 c9b2 0800 4500  .N....,.g.....E.
        0x0010:  0051 6606 4000 4011 fd2e c0a8 2b15 c0a8  .Qf.@.@.....+...
        0x0020:  2b01 af84 7d6c 003d da0d f1d0 0031 d100  +...}l.=.....1..
        0x0030:  000a 4152 5445 4d49 5300 0200 0000 0400  ..ARTEMIS.......
        0x0040:  0100 1900 0000 4f44 5577 4f44 6378 4d6a  ......ODUwODcxMj
        0x0050:  633d 0000 0000 0000 0000 0000 0000 00    c=.............
09:32:24.012688 IP 192.168.43.21.44932 > 192.168.43.1.32108: UDP, length 53
        0x0000:  1c4e a292 e0ff 2ccf 6718 c9b2 0800 4500  .N....,.g.....E.
        0x0010:  0051 660b 4000 4011 fd29 c0a8 2b15 c0a8  .Qf.@.@..)..+...
        0x0020:  2b01 af84 7d6c 003d da0d f1d0 0031 d100  +...}l.=.....1..
        0x0030:  000a 4152 5445 4d49 5300 0200 0000 0400  ..ARTEMIS.......
        0x0040:  0100 1900 0000 4f44 5577 4f44 6378 4d6a  ......ODUwODcxMj
        0x0050:  633d 0000 0000 0000 0000 0000 0000 00    c=.............
09:32:31.036175 IP 192.168.43.21.47091 > 255.255.255.255.32108: UDP, length 4
        0x0000:  ffff ffff ffff 2ccf 6718 c9b2 0800 4500  ......,.g.....E.
        0x0010:  0020 1130 4000 4011 3de0 c0a8 2b15 ffff  ...0@.@.=...+...
        0x0020:  ffff b7f3 7d6c 000c ed87 f130 0000       ....}l.....0..
09:32:31.036379 IP 192.168.43.21.47091 > 192.168.43.1.32108: UDP, length 4
        0x0000:  1c4e a292 e0ff 2ccf 6718 c9b2 0800 4500  .N....,.g.....E.
        0x0010:  0020 67c3 4000 4011 fba2 c0a8 2b15 c0a8  ..g.@.@.....+...
        0x0020:  2b01 b7f3 7d6c 000c 01de f130 0000       +...}l.....0..
09:32:31.048805 IP 192.168.43.1.40611 > 192.168.43.21.47091: UDP, length 24
        0x0000:  2ccf 6718 c9b2 1c4e a292 e0ff 0800 4500  ,.g....N......E.
        0x0010:  0034 0000 4000 4011 6352 c0a8 2b01 c0a8  .4..@.@.cR..+...
        0x0020:  2b15 9ea3 b7f3 0020 8036 f141 0014 4c42  +........6.A..LB
        0x0030:  4353 0000 0000 0000 0000 4343 434a 4a00  CS........CCCJJ.
        0x0040:  0000                                     ..
09:32:31.049245 IP 192.168.43.1.40611 > 192.168.43.21.47091: UDP, length 24
        0x0000:  2ccf 6718 c9b2 1c4e a292 e0ff 0800 4500  ,.g....N......E.
        0x0010:  0034 0000 4000 4011 6352 c0a8 2b01 c0a8  .4..@.@.cR..+...
        0x0020:  2b15 9ea3 b7f3 0020 8036 f141 0014 4c42  +........6.A..LB
        0x0030:  4353 0000 0000 0000 0000 4343 434a 4a00  CS........CCCJJ.
        0x0040:  0000                                     ..
09:32:31.138239 IP 192.168.43.21.47091 > 192.168.43.1.40611: UDP, length 4
        0x0000:  1c4e a292 e0ff 2ccf 6718 c9b2 0800 4500  .N....,.g.....E.
        0x0010:  0020 67cf 4000 4011 fb96 c0a8 2b15 c0a8  ..g.@.@.....+...
        0x0020:  2b01 b7f3 9ea3 000c dff6 f1e0 0000       +.............
09:32:31.188650 IP 192.168.43.21.47091 > 192.168.43.1.40611: UDP, length 4
        0x0000:  1c4e a292 e0ff 2ccf 6718 c9b2 0800 4500  .N....,.g.....E.
        0x0010:  0020 67dc 4000 4011 fb89 c0a8 2b15 c0a8  ..g.@.@.....+...
        0x0020:  2b01 b7f3 9ea3 000c dff5 f1e1 0000       +.............
09:32:32.195196 IP 192.168.43.21.47091 > 192.168.43.1.40611: UDP, length 53
        0x0000:  1c4e a292 e0ff 2ccf 6718 c9b2 0800 4500  .N....,.g.....E.
        0x0010:  0051 68b6 4000 4011 fa7e c0a8 2b15 c0a8  .Qh.@.@..~..+...
        0x0020:  2b01 b7f3 9ea3 003d b066 f1d0 0031 d100  +......=.f...1..
        0x0030:  000b 4152 5445 4d49 5300 0200 0000 0400  ..ARTEMIS.......
        0x0040:  0100 1900 0000 4f44 5577 4f44 6378 4d6a  ......ODUwODcxMj
        0x0050:  633d 0000 0000 0000 0000 0000 0000 00    c=.............
09:32:32.295551 IP 192.168.43.21.47091 > 192.168.43.1.40611: UDP, length 53
        0x0000:  1c4e a292 e0ff 2ccf 6718 c9b2 0800 4500  .N....,.g.....E.
        0x0010:  0051 68cd 4000 4011 fa67 c0a8 2b15 c0a8  .Qh.@.@..g..+...
        0x0020:  2b01 b7f3 9ea3 003d b066 f1d0 0031 d100  +......=.f...1..
        0x0030:  000b 4152 5445 4d49 5300 0200 0000 0400  ..ARTEMIS.......
        0x0040:  0100 1900 0000 4f44 5577 4f44 6378 4d6a  ......ODUwODcxMj
        0x0050:  633d 0000 0000 0000 0000 0000 0000 00    c=.............
09:32:32.395796 IP 192.168.43.21.47091 > 192.168.43.1.40611: UDP, length 53
        0x0000:  1c4e a292 e0ff 2ccf 6718 c9b2 0800 4500  .N....,.g.....E.
        0x0010:  0051 68cf 4000 4011 fa65 c0a8 2b15 c0a8  .Qh.@.@..e..+...
        0x0020:  2b01 b7f3 9ea3 003d b066 f1d0 0031 d100  +......=.f...1..
        0x0030:  000b 4152 5445 4d49 5300 0200 0000 0400  ..ARTEMIS.......
        0x0040:  0100 1900 0000 4f44 5577 4f44 6378 4d6a  ......ODUwODcxMj
        0x0050:  633d 0000 0000 0000 0000 0000 0000 00    c=.............
09:32:32.399337 IP 192.168.43.21.47091 > 192.168.43.1.32100: UDP, length 53
        0x0000:  1c4e a292 e0ff 2ccf 6718 c9b2 0800 4500  .N....,.g.....E.
        0x0010:  0051 68d0 4000 4011 fa64 c0a8 2b15 c0a8  .Qh.@.@..d..+...
        0x0020:  2b01 b7f3 7d64 003d d1a4 f1d0 0031 d100  +...}d.=.....1..
        0x0030:  000c 4152 5445 4d49 5300 0200 0000 0400  ..ARTEMIS.......
        0x0040:  0100 1900 0000 4f44 5577 4f44 6378 4d6a  ......ODUwODcxMj
        0x0050:  633d 0000 0000 0000 0000 0000 0000 00    c=.............
09:32:32.499643 IP 192.168.43.21.47091 > 192.168.43.1.32100: UDP, length 53
        0x0000:  1c4e a292 e0ff 2ccf 6718 c9b2 0800 4500  .N....,.g.....E.
        0x0010:  0051 68e7 4000 4011 fa4d c0a8 2b15 c0a8  .Qh.@.@..M..+...
        0x0020:  2b01 b7f3 7d64 003d d1a4 f1d0 0031 d100  +...}d.=.....1..
        0x0030:  000c 4152 5445 4d49 5300 0200 0000 0400  ..ARTEMIS.......
        0x0040:  0100 1900 0000 4f44 5577 4f44 6378 4d6a  ......ODUwODcxMj
        0x0050:  633d 0000 0000 0000 0000 0000 0000 00    c=.............
09:32:32.599927 IP 192.168.43.21.47091 > 192.168.43.1.32100: UDP, length 53
        0x0000:  1c4e a292 e0ff 2ccf 6718 c9b2 0800 4500  .N....,.g.....E.
        0x0010:  0051 68ed 4000 4011 fa47 c0a8 2b15 c0a8  .Qh.@.@..G..+...
        0x0020:  2b01 b7f3 7d64 003d d1a4 f1d0 0031 d100  +...}d.=.....1..
        0x0030:  000c 4152 5445 4d49 5300 0200 0000 0400  ..ARTEMIS.......
        0x0040:  0100 1900 0000 4f44 5577 4f44 6378 4d6a  ......ODUwODcxMj
        0x0050:  633d 0000 0000 0000 0000 0000 0000 00    c=.............
09:32:32.603311 IP 192.168.43.21.47091 > 192.168.43.1.32108: UDP, length 53
        0x0000:  1c4e a292 e0ff 2ccf 6718 c9b2 0800 4500  .N....,.g.....E.
        0x0010:  0051 68ee 4000 4011 fa46 c0a8 2b15 c0a8  .Qh.@.@..F..+...
        0x0020:  2b01 b7f3 7d6c 003d d19b f1d0 0031 d100  +...}l.=.....1..
        0x0030:  000d 4152 5445 4d49 5300 0200 0000 0400  ..ARTEMIS.......
        0x0040:  0100 1900 0000 4f44 5577 4f44 6378 4d6a  ......ODUwODcxMj
        0x0050:  633d 0000 0000 0000 0000 0000 0000 00    c=.............
09:32:32.703594 IP 192.168.43.21.47091 > 192.168.43.1.32108: UDP, length 53
        0x0000:  1c4e a292 e0ff 2ccf 6718 c9b2 0800 4500  .N....,.g.....E.
        0x0010:  0051 68fd 4000 4011 fa37 c0a8 2b15 c0a8  .Qh.@.@..7..+...
        0x0020:  2b01 b7f3 7d6c 003d d19b f1d0 0031 d100  +...}l.=.....1..
        0x0030:  000d 4152 5445 4d49 5300 0200 0000 0400  ..ARTEMIS.......
        0x0040:  0100 1900 0000 4f44 5577 4f44 6378 4d6a  ......ODUwODcxMj
        0x0050:  633d 0000 0000 0000 0000 0000 0000 00    c=.............
09:32:32.803883 IP 192.168.43.21.47091 > 192.168.43.1.32108: UDP, length 53
        0x0000:  1c4e a292 e0ff 2ccf 6718 c9b2 0800 4500  .N....,.g.....E.
        0x0010:  0051 6914 4000 4011 fa20 c0a8 2b15 c0a8  .Qi.@.@.....+...
        0x0020:  2b01 b7f3 7d6c 003d d19b f1d0 0031 d100  +...}l.=.....1..
        0x0030:  000d 4152 5445 4d49 5300 0200 0000 0400  ..ARTEMIS.......
        0x0040:  0100 1900 0000 4f44 5577 4f44 6378 4d6a  ......ODUwODcxMj
        0x0050:  633d 0000 0000 0000 0000 0000 0000 00    c=.............
09:32:41.820767 IP 192.168.43.21.50559 > 255.255.255.255.32108: UDP, length 4
        0x0000:  ffff ffff ffff 2ccf 6718 c9b2 0800 4500  ......,.g.....E.
        0x0010:  0020 167c 4000 4011 3894 c0a8 2b15 ffff  ...|@.@.8...+...
        0x0020:  ffff c57f 7d6c 000c dffb f130 0000       ....}l.....0..
09:32:41.820845 IP 192.168.43.21.50559 > 192.168.43.1.32108: UDP, length 4
        0x0000:  1c4e a292 e0ff 2ccf 6718 c9b2 0800 4500  .N....,.g.....E.
        0x0010:  0020 7191 4000 4011 f1d4 c0a8 2b15 c0a8  ..q.@.@.....+...
        0x0020:  2b01 c57f 7d6c 000c f451 f130 0000       +...}l...Q.0..
09:32:41.828849 IP 192.168.43.1.40611 > 192.168.43.21.50559: UDP, length 24
        0x0000:  2ccf 6718 c9b2 1c4e a292 e0ff 0800 4500  ,.g....N......E.
        0x0010:  0034 0000 4000 4011 6352 c0a8 2b01 c0a8  .4..@.@.cR..+...
        0x0020:  2b15 9ea3 c57f 0020 72aa f141 0014 4c42  +.......r..A..LB
        0x0030:  4353 0000 0000 0000 0000 4343 434a 4a00  CS........CCCJJ.
        0x0040:  0000                                     ..
09:32:41.829172 IP 192.168.43.1.40611 > 192.168.43.21.50559: UDP, length 24
        0x0000:  2ccf 6718 c9b2 1c4e a292 e0ff 0800 4500  ,.g....N......E.
        0x0010:  0034 0000 4000 4011 6352 c0a8 2b01 c0a8  .4..@.@.cR..+...
        0x0020:  2b15 9ea3 c57f 0020 72aa f141 0014 4c42  +.......r..A..LB
        0x0030:  4353 0000 0000 0000 0000 4343 434a 4a00  CS........CCCJJ.
        0x0040:  0000                                     ..
09:32:41.922031 IP 192.168.43.21.50559 > 192.168.43.1.40611: UDP, length 4
        0x0000:  1c4e a292 e0ff 2ccf 6718 c9b2 0800 4500  .N....,.g.....E.
        0x0010:  0020 7199 4000 4011 f1cc c0a8 2b15 c0a8  ..q.@.@.....+...
        0x0020:  2b01 c57f 9ea3 000c d26a f1e0 0000       +........j....
09:32:41.972386 IP 192.168.43.21.50559 > 192.168.43.1.40611: UDP, length 4
        0x0000:  1c4e a292 e0ff 2ccf 6718 c9b2 0800 4500  .N....,.g.....E.
        0x0010:  0020 719c 4000 4011 f1c9 c0a8 2b15 c0a8  ..q.@.@.....+...
        0x0020:  2b01 c57f 9ea3 000c d269 f1e1 0000       +........i....
09:32:42.975530 IP 192.168.43.21.50559 > 192.168.43.1.40611: UDP, length 53
        0x0000:  1c4e a292 e0ff 2ccf 6718 c9b2 0800 4500  .N....,.g.....E.
        0x0010:  0051 7226 4000 4011 f10e c0a8 2b15 c0a8  .Qr&@.@.....+...
        0x0020:  2b01 c57f 9ea3 003d a2d7 f1d0 0031 d100  +......=.....1..
        0x0030:  000e 4152 5445 4d49 5300 0200 0000 0400  ..ARTEMIS.......
        0x0040:  0100 1900 0000 4f44 5577 4f44 6378 4d6a  ......ODUwODcxMj
        0x0050:  633d 0000 0000 0000 0000 0000 0000 00    c=.............
09:32:43.075750 IP 192.168.43.21.50559 > 192.168.43.1.40611: UDP, length 53
        0x0000:  1c4e a292 e0ff 2ccf 6718 c9b2 0800 4500  .N....,.g.....E.
        0x0010:  0051 723b 4000 4011 f0f9 c0a8 2b15 c0a8  .Qr;@.@.....+...
        0x0020:  2b01 c57f 9ea3 003d a2d7 f1d0 0031 d100  +......=.....1..
        0x0030:  000e 4152 5445 4d49 5300 0200 0000 0400  ..ARTEMIS.......
        0x0040:  0100 1900 0000 4f44 5577 4f44 6378 4d6a  ......ODUwODcxMj
        0x0050:  633d 0000 0000 0000 0000 0000 0000 00    c=.............
09:32:43.175981 IP 192.168.43.21.50559 > 192.168.43.1.40611: UDP, length 53
        0x0000:  1c4e a292 e0ff 2ccf 6718 c9b2 0800 4500  .N....,.g.....E.
        0x0010:  0051 7242 4000 4011 f0f2 c0a8 2b15 c0a8  .QrB@.@.....+...
        0x0020:  2b01 c57f 9ea3 003d a2d7 f1d0 0031 d100  +......=.....1..
        0x0030:  000e 4152 5445 4d49 5300 0200 0000 0400  ..ARTEMIS.......
        0x0040:  0100 1900 0000 4f44 5577 4f44 6378 4d6a  ......ODUwODcxMj
        0x0050:  633d 0000 0000 0000 0000 0000 0000 00    c=.............
09:32:43.178126 IP 192.168.43.21.50559 > 192.168.43.1.32100: UDP, length 53
        0x0000:  1c4e a292 e0ff 2ccf 6718 c9b2 0800 4500  .N....,.g.....E.
        0x0010:  0051 7243 4000 4011 f0f1 c0a8 2b15 c0a8  .QrC@.@.....+...
        0x0020:  2b01 c57f 7d64 003d c415 f1d0 0031 d100  +...}d.=.....1..
        0x0030:  000f 4152 5445 4d49 5300 0200 0000 0400  ..ARTEMIS.......
        0x0040:  0100 1900 0000 4f44 5577 4f44 6378 4d6a  ......ODUwODcxMj
        0x0050:  633d 0000 0000 0000 0000 0000 0000 00    c=.............
09:32:43.278356 IP 192.168.43.21.50559 > 192.168.43.1.32100: UDP, length 53
        0x0000:  1c4e a292 e0ff 2ccf 6718 c9b2 0800 4500  .N....,.g.....E.
        0x0010:  0051 724f 4000 4011 f0e5 c0a8 2b15 c0a8  .QrO@.@.....+...
        0x0020:  2b01 c57f 7d64 003d c415 f1d0 0031 d100  +...}d.=.....1..
        0x0030:  000f 4152 5445 4d49 5300 0200 0000 0400  ..ARTEMIS.......
        0x0040:  0100 1900 0000 4f44 5577 4f44 6378 4d6a  ......ODUwODcxMj
        0x0050:  633d 0000 0000 0000 0000 0000 0000 00    c=.............
09:32:43.378559 IP 192.168.43.21.50559 > 192.168.43.1.32100: UDP, length 53
        0x0000:  1c4e a292 e0ff 2ccf 6718 c9b2 0800 4500  .N....,.g.....E.
        0x0010:  0051 7262 4000 4011 f0d2 c0a8 2b15 c0a8  .Qrb@.@.....+...
        0x0020:  2b01 c57f 7d64 003d c415 f1d0 0031 d100  +...}d.=.....1..
        0x0030:  000f 4152 5445 4d49 5300 0200 0000 0400  ..ARTEMIS.......
        0x0040:  0100 1900 0000 4f44 5577 4f44 6378 4d6a  ......ODUwODcxMj
        0x0050:  633d 0000 0000 0000 0000 0000 0000 00    c=.............
09:32:43.381157 IP 192.168.43.21.50559 > 192.168.43.1.32108: UDP, length 53
        0x0000:  1c4e a292 e0ff 2ccf 6718 c9b2 0800 4500  .N....,.g.....E.
        0x0010:  0051 7263 4000 4011 f0d1 c0a8 2b15 c0a8  .Qrc@.@.....+...
        0x0020:  2b01 c57f 7d6c 003d c40c f1d0 0031 d100  +...}l.=.....1..
        0x0030:  0010 4152 5445 4d49 5300 0200 0000 0400  ..ARTEMIS.......
        0x0040:  0100 1900 0000 4f44 5577 4f44 6378 4d6a  ......ODUwODcxMj
        0x0050:  633d 0000 0000 0000 0000 0000 0000 00    c=.............
09:32:43.481486 IP 192.168.43.21.50559 > 192.168.43.1.32108: UDP, length 53
        0x0000:  1c4e a292 e0ff 2ccf 6718 c9b2 0800 4500  .N....,.g.....E.
        0x0010:  0051 7275 4000 4011 f0bf c0a8 2b15 c0a8  .Qru@.@.....+...
        0x0020:  2b01 c57f 7d6c 003d c40c f1d0 0031 d100  +...}l.=.....1..
        0x0030:  0010 4152 5445 4d49 5300 0200 0000 0400  ..ARTEMIS.......
        0x0040:  0100 1900 0000 4f44 5577 4f44 6378 4d6a  ......ODUwODcxMj
        0x0050:  633d 0000 0000 0000 0000 0000 0000 00    c=.............
09:32:43.581831 IP 192.168.43.21.50559 > 192.168.43.1.32108: UDP, length 53
        0x0000:  1c4e a292 e0ff 2ccf 6718 c9b2 0800 4500  .N....,.g.....E.
        0x0010:  0051 728a 4000 4011 f0aa c0a8 2b15 c0a8  .Qr.@.@.....+...
        0x0020:  2b01 c57f 7d6c 003d c40c f1d0 0031 d100  +...}l.=.....1..
        0x0030:  0010 4152 5445 4d49 5300 0200 0000 0400  ..ARTEMIS.......
        0x0040:  0100 1900 0000 4f44 5577 4f44 6378 4d6a  ......ODUwODcxMj
        0x0050:  633d 0000 0000 0000 0000 0000 0000 00    c=.............
09:32:56.596775 IP 192.168.43.21.54888 > 255.255.255.255.32108: UDP, length 4
        0x0000:  ffff ffff ffff 2ccf 6718 c9b2 0800 4500  ......,.g.....E.
        0x0010:  0020 1a46 4000 4011 34ca c0a8 2b15 ffff  ...F@.@.4...+...
        0x0020:  ffff d668 7d6c 000c cf12 f130 0000       ...h}l.....0..
09:32:56.596852 IP 192.168.43.21.54888 > 192.168.43.1.32108: UDP, length 4
        0x0000:  1c4e a292 e0ff 2ccf 6718 c9b2 0800 4500  .N....,.g.....E.
        0x0010:  0020 77cc 4000 4011 eb99 c0a8 2b15 c0a8  ..w.@.@.....+...
        0x0020:  2b01 d668 7d6c 000c e368 f130 0000       +..h}l...h.0..
09:32:56.620643 IP 192.168.43.1.40611 > 192.168.43.21.54888: UDP, length 24
        0x0000:  2ccf 6718 c9b2 1c4e a292 e0ff 0800 4500  ,.g....N......E.
        0x0010:  0034 0000 4000 4011 6352 c0a8 2b01 c0a8  .4..@.@.cR..+...
        0x0020:  2b15 9ea3 d668 0020 61c1 f141 0014 4c42  +....h..a..A..LB
        0x0030:  4353 0000 0000 0000 0000 4343 434a 4a00  CS........CCCJJ.
        0x0040:  0000                                     ..
09:32:56.621006 IP 192.168.43.1.40611 > 192.168.43.21.54888: UDP, length 24
        0x0000:  2ccf 6718 c9b2 1c4e a292 e0ff 0800 4500  ,.g....N......E.
        0x0010:  0034 0000 4000 4011 6352 c0a8 2b01 c0a8  .4..@.@.cR..+...
        0x0020:  2b15 9ea3 d668 0020 61c1 f141 0014 4c42  +....h..a..A..LB
        0x0030:  4353 0000 0000 0000 0000 4343 434a 4a00  CS........CCCJJ.
        0x0040:  0000                                     ..
09:32:56.698054 IP 192.168.43.21.54888 > 192.168.43.1.40611: UDP, length 4
        0x0000:  1c4e a292 e0ff 2ccf 6718 c9b2 0800 4500  .N....,.g.....E.
        0x0010:  0020 77d3 4000 4011 eb92 c0a8 2b15 c0a8  ..w.@.@.....+...
        0x0020:  2b01 d668 9ea3 000c c181 f1e0 0000       +..h..........
09:32:56.748419 IP 192.168.43.21.54888 > 192.168.43.1.40611: UDP, length 4
        0x0000:  1c4e a292 e0ff 2ccf 6718 c9b2 0800 4500  .N....,.g.....E.
        0x0010:  0020 77d8 4000 4011 eb8d c0a8 2b15 c0a8  ..w.@.@.....+...
        0x0020:  2b01 d668 9ea3 000c c180 f1e1 0000       +..h..........
09:32:57.751600 IP 192.168.43.21.54888 > 192.168.43.1.40611: UDP, length 53
        0x0000:  1c4e a292 e0ff 2ccf 6718 c9b2 0800 4500  .N....,.g.....E.
        0x0010:  0051 7884 4000 4011 eab0 c0a8 2b15 c0a8  .Qx.@.@.....+...
        0x0020:  2b01 d668 9ea3 003d 91eb f1d0 0031 d100  +..h...=.....1..
        0x0030:  0011 4152 5445 4d49 5300 0200 0000 0400  ..ARTEMIS.......
        0x0040:  0100 1900 0000 4f44 5577 4f44 6378 4d6a  ......ODUwODcxMj
        0x0050:  633d 0000 0000 0000 0000 0000 0000 00    c=.............
09:32:57.851811 IP 192.168.43.21.54888 > 192.168.43.1.40611: UDP, length 53
        0x0000:  1c4e a292 e0ff 2ccf 6718 c9b2 0800 4500  .N....,.g.....E.
        0x0010:  0051 7885 4000 4011 eaaf c0a8 2b15 c0a8  .Qx.@.@.....+...
        0x0020:  2b01 d668 9ea3 003d 91eb f1d0 0031 d100  +..h...=.....1..
        0x0030:  0011 4152 5445 4d49 5300 0200 0000 0400  ..ARTEMIS.......
        0x0040:  0100 1900 0000 4f44 5577 4f44 6378 4d6a  ......ODUwODcxMj
        0x0050:  633d 0000 0000 0000 0000 0000 0000 00    c=.............
09:32:57.952057 IP 192.168.43.21.54888 > 192.168.43.1.40611: UDP, length 53
        0x0000:  1c4e a292 e0ff 2ccf 6718 c9b2 0800 4500  .N....,.g.....E.
        0x0010:  0051 7888 4000 4011 eaac c0a8 2b15 c0a8  .Qx.@.@.....+...
        0x0020:  2b01 d668 9ea3 003d 91eb f1d0 0031 d100  +..h...=.....1..
        0x0030:  0011 4152 5445 4d49 5300 0200 0000 0400  ..ARTEMIS.......
        0x0040:  0100 1900 0000 4f44 5577 4f44 6378 4d6a  ......ODUwODcxMj
        0x0050:  633d 0000 0000 0000 0000 0000 0000 00    c=.............
09:32:57.954419 IP 192.168.43.21.54888 > 192.168.43.1.32100: UDP, length 53
        0x0000:  1c4e a292 e0ff 2ccf 6718 c9b2 0800 4500  .N....,.g.....E.
        0x0010:  0051 7889 4000 4011 eaab c0a8 2b15 c0a8  .Qx.@.@.....+...
        0x0020:  2b01 d668 7d64 003d b329 f1d0 0031 d100  +..h}d.=.)...1..
        0x0030:  0012 4152 5445 4d49 5300 0200 0000 0400  ..ARTEMIS.......
        0x0040:  0100 1900 0000 4f44 5577 4f44 6378 4d6a  ......ODUwODcxMj
        0x0050:  633d 0000 0000 0000 0000 0000 0000 00    c=.............
09:32:58.054629 IP 192.168.43.21.54888 > 192.168.43.1.32100: UDP, length 53
        0x0000:  1c4e a292 e0ff 2ccf 6718 c9b2 0800 4500  .N....,.g.....E.
        0x0010:  0051 7894 4000 4011 eaa0 c0a8 2b15 c0a8  .Qx.@.@.....+...
        0x0020:  2b01 d668 7d64 003d b329 f1d0 0031 d100  +..h}d.=.)...1..
        0x0030:  0012 4152 5445 4d49 5300 0200 0000 0400  ..ARTEMIS.......
        0x0040:  0100 1900 0000 4f44 5577 4f44 6378 4d6a  ......ODUwODcxMj
        0x0050:  633d 0000 0000 0000 0000 0000 0000 00    c=.............
09:32:58.154847 IP 192.168.43.21.54888 > 192.168.43.1.32100: UDP, length 53
        0x0000:  1c4e a292 e0ff 2ccf 6718 c9b2 0800 4500  .N....,.g.....E.
        0x0010:  0051 789e 4000 4011 ea96 c0a8 2b15 c0a8  .Qx.@.@.....+...
        0x0020:  2b01 d668 7d64 003d b329 f1d0 0031 d100  +..h}d.=.)...1..
        0x0030:  0012 4152 5445 4d49 5300 0200 0000 0400  ..ARTEMIS.......
        0x0040:  0100 1900 0000 4f44 5577 4f44 6378 4d6a  ......ODUwODcxMj
        0x0050:  633d 0000 0000 0000 0000 0000 0000 00    c=.............
09:32:58.157620 IP 192.168.43.21.54888 > 192.168.43.1.32108: UDP, length 53
        0x0000:  1c4e a292 e0ff 2ccf 6718 c9b2 0800 4500  .N....,.g.....E.
        0x0010:  0051 789f 4000 4011 ea95 c0a8 2b15 c0a8  .Qx.@.@.....+...
        0x0020:  2b01 d668 7d6c 003d b320 f1d0 0031 d100  +..h}l.=.....1..
        0x0030:  0013 4152 5445 4d49 5300 0200 0000 0400  ..ARTEMIS.......
        0x0040:  0100 1900 0000 4f44 5577 4f44 6378 4d6a  ......ODUwODcxMj
        0x0050:  633d 0000 0000 0000 0000 0000 0000 00    c=.............
09:32:58.257846 IP 192.168.43.21.54888 > 192.168.43.1.32108: UDP, length 53
        0x0000:  1c4e a292 e0ff 2ccf 6718 c9b2 0800 4500  .N....,.g.....E.
        0x0010:  0051 78b7 4000 4011 ea7d c0a8 2b15 c0a8  .Qx.@.@..}..+...
        0x0020:  2b01 d668 7d6c 003d b320 f1d0 0031 d100  +..h}l.=.....1..
        0x0030:  0013 4152 5445 4d49 5300 0200 0000 0400  ..ARTEMIS.......
        0x0040:  0100 1900 0000 4f44 5577 4f44 6378 4d6a  ......ODUwODcxMj
        0x0050:  633d 0000 0000 0000 0000 0000 0000 00    c=.............
09:32:58.358083 IP 192.168.43.21.54888 > 192.168.43.1.32108: UDP, length 53
        0x0000:  1c4e a292 e0ff 2ccf 6718 c9b2 0800 4500  .N....,.g.....E.
        0x0010:  0051 78bd 4000 4011 ea77 c0a8 2b15 c0a8  .Qx.@.@..w..+...
        0x0020:  2b01 d668 7d6c 003d b320 f1d0 0031 d100  +..h}l.=.....1..
        0x0030:  0013 4152 5445 4d49 5300 0200 0000 0400  ..ARTEMIS.......
        0x0040:  0100 1900 0000 4f44 5577 4f44 6378 4d6a  ......ODUwODcxMj
        0x0050:  633d 0000 0000 0000 0000 0000 0000 00    c=.............
pi@raspberrypi:/tmp $ 

Output from https://github.com/philibertschlutzki/pi_trailcam/blob/main/tests/MITM_Captures/export%20packets.txt

Frame 2746: Packet, 129 bytes on wire (1032 bits), 129 bytes captured (1032 bits)
Linux cooked capture v2
Internet Protocol Version 4, Src: 192.168.43.1, Dst: 192.168.43.115
Internet Control Message Protocol

No.     Time           Source                Destination           Protocol Length Info
   2747 238.576601     192.168.43.115        192.168.43.1          UDP      101    43555 → 40611 Len=53

Frame 2747: Packet, 101 bytes on wire (808 bits), 101 bytes captured (808 bits)
Linux cooked capture v2
Internet Protocol Version 4, Src: 192.168.43.115, Dst: 192.168.43.1
User Datagram Protocol, Src Port: 43555, Dst Port: 40611
Data (53 bytes)

0000  f1 d0 00 31 d1 00 00 05 41 52 54 45 4d 49 53 00   ...1....ARTEMIS.
0010  02 00 00 00 04 00 01 00 19 00 00 00 4d 7a 6c 42   ............MzlB
0020  33 36 58 2f 49 56 6f 38 5a 7a 49 35 72 47 39 6a   36X/IVo8ZzI5rG9j
0030  31 77 3d 3d 00                                    1w==.

No.     Time           Source                Destination           Protocol Length Info
   2748 238.576760     192.168.43.1          192.168.43.115        ICMP     129    Destination unreachable (Port unreachable)

Frame 2748: Packet, 129 bytes on wire (1032 bits), 129 bytes captured (1032 bits)
Linux cooked capture v2
Internet Protocol Version 4, Src: 192.168.43.1, Dst: 192.168.43.115
Internet Control Message Protocol

No.     Time           Source                Destination           Protocol Length Info
   2749 239.011924     192.168.43.115        192.168.43.1          UDP      101    43555 → 40611 Len=53

Frame 2749: Packet, 101 bytes on wire (808 bits), 101 bytes captured (808 bits)
Linux cooked capture v2
Internet Protocol Version 4, Src: 192.168.43.115, Dst: 192.168.43.1
User Datagram Protocol, Src Port: 43555, Dst Port: 40611
Data (53 bytes)

0000  f1 d0 00 31 d1 00 00 05 41 52 54 45 4d 49 53 00   ...1....ARTEMIS.
0010  02 00 00 00 04 00 01 00 19 00 00 00 4d 7a 6c 42   ............MzlB
0020  33 36 58 2f 49 56 6f 38 5a 7a 49 35 72 47 39 6a   36X/IVo8ZzI5rG9j
0030  31 77 3d 3d 00                                    1w==.

No.     Time           Source                Destination           Protocol Length Info
   2750 239.012095     192.168.43.1          192.168.43.115        ICMP     129    Destination unreachable (Port unreachable)

Frame 2750: Packet, 129 bytes on wire (1032 bits), 129 bytes captured (1032 bits)
Linux cooked capture v2
Internet Protocol Version 4, Src: 192.168.43.1, Dst: 192.168.43.115
Internet Control Message Protocol

No.     Time           Source                Destination           Protocol Length Info
   2751 239.012316     192.168.43.115        192.168.43.1          UDP      101    43555 → 40611 Len=53

Frame 2751: Packet, 101 bytes on wire (808 bits), 101 bytes captured (808 bits)
Linux cooked capture v2
Internet Protocol Version 4, Src: 192.168.43.115, Dst: 192.168.43.1
User Datagram Protocol, Src Port: 43555, Dst Port: 40611
Data (53 bytes)

0000  f1 d0 00 31 d1 00 00 05 41 52 54 45 4d 49 53 00   ...1....ARTEMIS.
0010  02 00 00 00 04 00 01 00 19 00 00 00 4d 7a 6c 42   ............MzlB
0020  33 36 58 2f 49 56 6f 38 5a 7a 49 35 72 47 39 6a   36X/IVo8ZzI5rG9j
0030  31 77 3d 3d 00                                    1w==.

No.     Time           Source                Destination           Protocol Length Info
   2752 239.012379     192.168.43.1          192.168.43.115        ICMP     129    Destination unreachable (Port unreachable)

Frame 2752: Packet, 129 bytes on wire (1032 bits), 129 bytes captured (1032 bits)
Linux cooked capture v2
Internet Protocol Version 4, Src: 192.168.43.1, Dst: 192.168.43.115
Internet Control Message Protocol

No.     Time           Source                Destination           Protocol Length Info
   2753 239.012469     192.168.43.115        192.168.43.1          UDP      101    43555 → 40611 Len=53

Frame 2753: Packet, 101 bytes on wire (808 bits), 101 bytes captured (808 bits)
Linux cooked capture v2
Internet Protocol Version 4, Src: 192.168.43.115, Dst: 192.168.43.1
User Datagram Protocol, Src Port: 43555, Dst Port: 40611
Data (53 bytes)

0000  f1 d0 00 31 d1 00 00 05 41 52 54 45 4d 49 53 00   ...1....ARTEMIS.
0010  02 00 00 00 04 00 01 00 19 00 00 00 4d 7a 6c 42   ............MzlB
0020  33 36 58 2f 49 56 6f 38 5a 7a 49 35 72 47 39 6a   36X/IVo8ZzI5rG9j
0030  31 77 3d 3d 00                                    1w==.
